<?xml version="1.0" encoding="UTF-8"?>
<?xml-stylesheet type="text/css" href="ejercicio4.css"?>
<!DOCTYPE federacion SYSTEM "ejercicio4.dtd">
<federacion nombre_fed="Federacion Española de Fútbol">
    <liga codigo="ESP" num_equipo="20" nombre_liga='Española'>
        <equipo siglas="ESP" anio_fundacion="2004" tamanio_plantilla="30" nombre_equipo="Cádiz FC">
            <mayor>
                <cuerpo_tecnico>
                    <director_tecnico>Ricardo</director_tecnico>
                    <preparador_fisico id="pf1">Juan</preparador_fisico>
                    <doctor id="d1">Eliseo</doctor>
                    <asistentes id="a1">Alessandro</asistentes>
                    <asistentes id="a2">Manuel</asistentes>
                </cuerpo_tecnico>
                <jugador dorsal='11' posicion="delantero" no-identificacion='P887493-3' año-contratado='1980'>
                    <nombre>Jorge</nombre>
                    <apellido>Mágico</apellido>
                    <salario>10</salario>
                </jugador>
                <jugador dorsal='10' posicion="delantero" no-identificacion='P45493-3' año-contratado='1980'>
                    <nombre>Jorge</nombre>
                    <apellido>Mágico</apellido>
                    <salario>10</salario>
                </jugador>
                <jugador dorsal='9' posicion="delantero" no-identificacion='P83457493-3' año-contratado='1980'>
                    <nombre>Jorge</nombre>
                    <apellido>Mágico</apellido>
                    <salario>10</salario>
                </jugador>
                <jugador dorsal='8' posicion="delantero" no-identificacion='P8877393-3' año-contratado='1980'>
                    <nombre>Jorge</nombre>
                    <apellido>Mágico</apellido>
                    <salario>10</salario>
                </jugador>
            </mayor>
            <femenil>
                <cuerpo_tecnico>
                    <director_tecnico>Ricardo</director_tecnico>
                    <preparador_fisico id="pf1">Juan</preparador_fisico>
                    <doctor id="d1">Eliseo</doctor>
                    <asistentes id="a1">Alessandro</asistentes>
                    <asistentes id="a2">Manuel</asistentes>
                </cuerpo_tecnico>
                <jugador dorsal='11' posicion="delantero" no-identificacion='P882493-3' año-contratado='2015'>
                    <nombre>Alexia</nombre>
                    <apellido>Putellas</apellido>
                    <salario>10000</salario>
                </jugador>
            </femenil>
            <reserva>
                <cuerpo_tecnico>
                    <director_tecnico>Ricardo</director_tecnico>
                    <preparador_fisico id="pf1">Juan</preparador_fisico>
                    <doctor id="d1">Eliseo</doctor>
                    <asistentes id="a1">Alessandro</asistentes>
                    <asistentes id="a2">Manuel</asistentes>
                </cuerpo_tecnico>
                <jugador dorsal='11' posicion="delantero" no-identificacion='P887593-3' año-contratado='1980'>
                    <nombre>Jorge</nombre>
                    <apellido>Mágico</apellido>
                    <salario>10</salario>
                </jugador>
            </reserva>
            <trofeo anio="1992" marcador="10-0" rival="Barca">Joan Gamper</trofeo>
            <trofeo anio="1992" marcador="10-0" rival="Barca">Joan Gamper</trofeo>
            <figura_celebre periodo="8" posiscion="delantero" goles="20" asistencias="10">Magico Gonzalez</figura_celebre>
        </equipo>
    </liga>
</federacion>